### ISSUE TITLE
[Bug] TUN模式下，DNAT入站流量无法回包出站的问题

### ISSUE THREAD

**Issue by huzheyi** [MetaCubeX/mihomo#1493]
### Verify steps

- [X] I have read the [documentation](https://wiki.metacubex.one/) and understand the meaning of all configuration items I have written, avoiding a large number of seemingly useful options or default values.
- [X] I have not reviewed the [documentation](https://wiki.metacubex.one/) and resolve this issue.
- [X] I have not searched the [Issue Tracker](……/)  for the problem I am going to raise.
- [X] I have tested with the latest Alpha branch version, and the issue still persists.
- [X] I have provided server and client configuration files and processes that can reproduce the issue locally, rather than a desensitized complex client configuration file.
- [X] I have provided the simplest configuration that can reproduce the error I reported, rather than relying on remote servers, TUN, graphical client interfaces, or other closed-source software.
- [X] I have provided complete configuration files and logs, rather than providing only parts that I believe are useful due to confidence in my own intelligence.

### Operating System

Linux

### System Version

vyos 1.5

### Mihomo Version

Mihomo Meta alpha-43f21c0 linux amd64 with go1.23.0 Mon Sep  2 08:24:57 UTC 2024
Use tags: with_gvisor

### Configuration File

```yaml
#port: 7890
#socks-port: 7891
mixed-port: 7890
#redir-port: 7892
#tproxy-port: 9898

allow-lan: true
bind-address: '*'

find-process-mode: strict

mode: rule

geox-url:
  geoip: "https://fastly.jsdelivr.net/gh/MetaCubeX/meta-rules-dat@release/geoip.dat"
  geosite: "https://fastly.jsdelivr.net/gh/MetaCubeX/meta-rules-dat@release/geosite.dat"
  mmdb: "https://fastly.jsdelivr.net/gh/MetaCubeX/meta-rules-dat@release/geoip.metadb"

# geodata-mode: true
geodata-loader: standard
geo-auto-update: true
geo-update-interval: 72

log-level: warning

ipv6: true

external-controller: 0.0.0.0:9090

tcp-concurrent: true

external-ui: /root/.config/mihomo/ui
external-ui-url: "https://github.com/MetaCubeX/metacubexd/archive/refs/heads/gh-pages.zip"

global-client-fingerprint: ios

profile:
  store-selected: true
  store-fake-ip: true

tun:
  enable: true
  stack: mixed
  dns-hijack:
    - 'any:53'
  auto-route: true
#  auto-redirect: true
  auto-detect-interface: true
  gso: true
  gso-max-size: 65536

sniffer:
  enable: true
  sniff:
    TLS:
      ports: [443, 8443]
    HTTP:
      ports: [80, 8080-8880]
      override-destination: true
    QUIC:
      ports: [443,8443]
  force-domain:
    - +.v2ex.com
  skip-domain:
     - Mijia Cloud

dns:
  cache-algorithm: arc
  enable: true
  prefer-h3: true
  listen: :5353
  ipv6: true

  default-nameserver:
    - 119.29.29.29
    - 223.5.5.5
    - system

  enhanced-mode: fake-ip
  fake-ip-range: 198.18.0.1/16
  # use-hosts: true

  respect-rules: false

  fake-ip-filter:
     - '*.lan'
     - '*.linksys.com'
     - '+.pool.ntp.org'
     - localhost.ptlogin2.qq.com
     - openpgpkey.kernel.org

  nameserver:
    - https://doh.pub/dns-query
    - https://dns.alidns.com/dns-query

  fallback:
    - https://1.1.1.1/dns-query
    - tls://1.0.0.1:853

  fallback-filter:
    geoip: true
    geoip-code: CN
    geosite:
      - gfw
    ipcidr:
      - 240.0.0.0/4
    domain:
      - '+.google.com'
      - '+.facebook.com'
      - '+.youtube.com'

  nameserver-policy:
    "geosite:private,cn,private,apple,microsoft@cn,category-games@cn":
      - https://doh.pub/dns-query
      - https://dns.alidns.com/dns-query

proxies:

...省略

rule-providers:
  bypass-source:
    type: file
    behavior: classical
    path: "bypass-source.yaml"

rules:

  - RULE-SET,bypass-source,DIRECT
  - GEOIP,private,DIRECT
  - GEOIP,cn,DIRECT
  - GEOSITE,private,DIRECT
  - GEOSITE,cn,DIRECT
  - GEOSITE,apple,DIRECT
  - GEOSITE,microsoft@cn,DIRECT
  - GEOSITE,category-games@cn,DIRECT
  - GEOIP,telegram,PROXY,no-resolve
  - MATCH,PROXY
```

### Description

我是在vyos上通过container host模式运行的mihomo 1.18.8

我的情况是vyos上配置了dnat映射，经过抓包发现
当从外部网络访问我映射的服务时

1. 数据包先从pppoe0接口进入，从pppoe0接口抓包可以看到

```
15:50:28.099265 IP 43.226.237.69.32153 > 123.117.170.178.4433: Flags [S], seq 2965468837, win 64240, options [mss 1448,sackOK,TS val 70108068 ecr 0,nop,wscale 7], length 0
```

2. 然后数据包根据dnat规则转发到内网，从br0接口抓包可以看到

```
15:50:28.099505 IP 43.226.237.69.32153 > 192.168.1.41.443: Flags [S], seq 2965468837, win 64240, options [mss 1448,sackOK,TS val 70108068 ecr 0,nop,wscale 7], length 0
```

3. 随后内网服务器响应tcp请求发送ack，从br0接口抓包可以看到

```
15:50:28.099613 IP 192.168.1.41.443 > 43.226.237.69.32153: Flags [S.], seq 3703792511, ack 2965468838, win 31856, options [mss 1460,sackOK,TS val 1923171828 ecr 70108068,nop,wscale 7], length 0
```

4.之后这个数据包就进入了Meta接口，从Meta接口抓包可以看到

```
15:50:28.099742 IP 123.117.170.178.4433 > 43.226.237.69.32153: Flags [S.], seq 3703792511, ack 2965468838, win 31856, options [mss 1460,sackOK,TS val 1923171828 ecr 70108068,nop,wscale 7], length 0
```

5. 正常此时这个数据包应该可以在pppoe0上可以看到，事实上却没有，同时外部网络的这台主机也接收不到任何回包

当我关闭mihomo时相关数据包可以在pppoe0和br0上被正常捕获，我确认这与我vyos的防火墙无关，因为关闭防火墙全通策略下也是这样的表现。

我不知道到4这一步时，正常的表现应该是：

1. 内网服务器响应的数据包不进入Meta接口，而从pppoe0直接出去
还是：
2.内网服务器响应的数据包进入Meta接口，然后再从pppoe0出去

但无论如何，确实外部网络的主机无法收到任何回包。

内网主机正常访问外网表现为完全正常。

### Reproduction Steps

vyos dnat配置

```
set nat destination rule 101 inbound-interface name pppoe0
set nat destination rule 101 destination port 4433
set nat destination rule 101 protocol tcp
set nat destination rule 101 translation address 192.168.1.41
set nat destination rule 101 translation port 443
```

vyos mihomo容器配置

```
 allow-host-networks
 capability net-admin
 device tun {
     destination /dev/net/tun
     source /dev/net/tun
 }
 host-name mihomo
 image docker.io/metacubex/mihomo:Alpha
 restart always
 volume mihomo {
     destination /root/.config/mihomo
     source /config/user-data/mihomo
 }
```

在mihomo alpha、v1.18.8、v1.18.5版本测试表现相同

### Logs

```shell
DEBUG模式下未能捕获任何相关日志
```

**Comment by huzheyi** [comment]
今天在虚拟化平台构建了一个简单的测试环境，对这个问题进行专项测试
vyos虚拟机
eth0(wan):静态ip,192.168.1.250/24
br0(lan):dhcp-server, 172.20.0.1/24
内网服务器: 172.20.0.107/24

在vyos配置相同的防火墙策略、snat masquerade策略和dnat策略，将内网服务器22端口映射到wan的2222端口
从外部192.168.1.93机器访问 192.168.1.250:2222，在启用mihomo的情况下正常访问

抓包Meta接口看不到任何流量，应该是入站流量和出站流量没有经过mihomo处理。

很匪夷所思

如果说这两个环境有区别，比较大的区别可能在我正式环境的vyos拥有eth0、eth1、eth2、eth3四个端口
eth0上建立pppoe0接口连接互联网
eth1连接了上游路由器的iptv网络、未配置地址、用于接收igmp组播流量
eth1子接口vif3010桥接了上游路由器的voip网络、配置静态地址
eth2和eth3作为br0的成员接口、成为lan网络、下接交换机

我猜测有没有可能mihomo面对比较多的网络接口时出现了什么bug导致流量被错误导入到tun设备？


补充一下我mihomo在vyos设备上创建的ip rule规则和2022路由表

```
//ip rule 
0:	from all lookup local
9000:	from all to 198.18.0.0/30 lookup 2022
9001:	not from all dport 53 lookup main suppress_prefixlength 0
9001:	from all ipproto icmp goto 9010
9001:	from all iif Meta goto 9010
9002:	not from all iif lo lookup 2022
9002:	from 0.0.0.0 iif lo lookup 2022
9002:	from 198.18.0.0/30 iif lo lookup 2022
9010:	from all nop
32766:	from all lookup main
32767:	from all lookup default

//route table 2022
Codes: K - kernel route, C - connected, S - static, R - RIP,
       O - OSPF, I - IS-IS, B - BGP, E - EIGRP, N - NHRP,
       T - Table, v - VNC, V - VNC-Direct, A - Babel, F - PBR,
       f - OpenFabric,
       > - selected route, * - FIB route, q - queued, r - rejected, b - backup
       t - trapped, o - offload failure

VRF default table 2022:
K>* 0.0.0.0/0 [0/0] is directly connected, Meta, 1d01h12m
```
经过比较正式环境与测试环境上述量表内容相同，另，mihomo配置也相同

**Comment by huzheyi** [comment]
又在正式环境里测试了将内网端口映射到eth0上（而非pppoe0）的情况，从连接eth0的上游设备上是可以正常访问的。

现在看来原因逐渐清晰起来，当我映射到pppoe0上时：
入站请求：数据包(from public ip) --> wan --dnat--> br0 --> host，这个过程mihomo没有参与
出站流量：数据包( to public ip )   --> host --> br0  --snat--> tun，这个过程的流量在snat后可能被mihomo视作一个新的连接请求从而劫持

至于这个流量是否真的出站了，目前我无法确定，理论上他应该可以出站，而我在外部服务器上抓不到包也可能是由于数据包的state不对而被云服务器的防火墙当作一个new的连接给drop掉了，这个我要再测试一下

而当我映射到eth0上时，由于eth0上是一个私网地址，所以出站流量不会被mihomo劫持，也自然在Meta接口抓不到包。

**Comment by huzheyi** [comment]
在openclash项目里查到两个issue，应该目前是通过读取openwrt的端口映射配置，然后把相关端口的访问提前在iptables里retune掉了。很不优雅。。
https://github.com/vernesong/OpenClash/issues/146
https://github.com/vernesong/OpenClash/issues/525

**Comment by Wacchi-Lorie** [comment]
这个问题是否与[#281](https://github.com/MetaCubeX/mihomo/issues/281)也有关?
我在使用tun模式过后 尝试过了所有模式 也尝试了没有使用任何节点的情况 游戏均显示strict nat 设置的udp端口转发也都失效了

**Comment by huzheyi** [comment]
> 这个问题是否与[#281](https://github.com/MetaCubeX/mihomo/issues/281)也有关? 我在使用tun模式过后 尝试过了所有模式 也尝试了没有使用任何节点的情况 游戏均显示strict nat 设置的udp端口转发也都失效了

我这边测试只要是dnat到wan ip的内网服务，无论tcp/udp，都是我说的这个状态。

**Comment by WangShayne** [comment]
开启tun后,端口转发从外部访问失效 
MobileNetwork  --> a.com:1234 (公网ip)  --> 192.168.1.99:4321 ❌
但如果我从局域网内访问外部端口,却是可以
Wifi --> a.com:1234 (公网ip)  --> 192.168.1.99:4321 ✔

**Comment by WanQiyang** [comment]
试试 `endpoint-independent-nat: true` 呢，我这边可以临时解决

**Comment by huzheyi** [comment]
> 试试 `endpoint-independent-nat: true` 呢，我这边可以临时解决

这个参数什么意思其实不太理解，能否解释一下？

**Comment by huzheyi** [comment]
> 我暂时把docker container改为host了

我暂时跑了tproxy模式，其实tproxy效率还更好一些。

**Comment by WangShayne** [comment]
> 大佬们咋解决的啊 ，有点看不懂啊 ，docker 部署host模式的外网访问不了nas

 ufw开了吗

**Comment by halfroom** [comment]
我也遇到了。我是truenas，但是之前的truenas版本是没问题的，怀疑之前是因为k8s自动给做了iptables

**Comment by huzheyi** [comment]
> 我也遇到了。我是truenas，但是之前的truenas版本是没问题的，怀疑之前是因为k8s自动给做了iptables

我觉得您这个情况应该和我描述的不太一样。你的truenas应该工作在类似于“旁路由”模式，不会跨三层吧？

**Comment by huzheyi** [comment]
> > > 我也遇到了。我是truenas，但是之前的truenas版本是没问题的，怀疑之前是因为k8s自动给做了iptables
> > 
> > 
> > 我觉得您这个情况应该和我描述的不太一样。你的truenas应该工作在类似于“旁路由”模式，不会跨三层吧？
> 
> 不是的，我是直接用docker host模式在TrueNAS上启动的：
> 
> ```yaml
> version: "3"  
> services:  
>   metacubexd:
>     container_name: metacubexd
>     image: ghcr.io/metacubex/metacubexd
>     restart: always
>     ports:
>       - 80:80
>   mihomo:
>     container_name: mihomo
>     image: docker.io/metacubex/mihomo:Alpha
>     restart: always
>     pid: host
>     ipc: host
>     network_mode: host
>     cap_add:
>       - ALL
>     volumes:
>       - ./mihomo:/root/.config/mihomo
>       - /dev/net/tun:/dev/net/tun
> ```

我的mihomo是运行在路由器上，路由器出接口是pppoe，下游设备接入vswitch，路由器需要做SNAT。你这个情况应该truenas只有一个网络接口，比如都是eth0接入到网络中吧。

**Comment by huzheyi** [comment]
> > 我的mihomo是运行在路由器上，路由器出接口是pppoe，下游设备接入vswitch，路由器需要做SNAT。你这个情况应该truenas只有一个网络接口，比如都是eth0接入到网络中吧。
> 
> 是的，我是单网口。但是，我之前用的TrueNAS Bluefish版本没有这个问题，而且在windows上，也没有这个问题

嗯，所以应该不是一个问题。你是用truenas自带的k3s跑的吧？可以看看k3s中关于pod的ingress/egress网络策略配置。

**Comment by halfroom** [comment]
> > > 我的mihomo是运行在路由器上，路由器出接口是pppoe，下游设备接入vswitch，路由器需要做SNAT。你这个情况应该truenas只有一个网络接口，比如都是eth0接入到网络中吧。
> > 
> > 
> > 是的，我是单网口。但是，我之前用的TrueNAS Bluefish版本没有这个问题，而且在windows上，也没有这个问题
> 
> 嗯，所以应该不是一个问题。你是用truenas自带的k3s跑的吧？可以看看k3s中关于pod的ingress/egress网络策略配置。

倒不是用自带的k3s跑的，是通过portainer跑的，portainer用的k3s启动的。现在已经看不到策略啦，，因为升级后已经没有k3s了，TrueNAS抛弃了k3s。。。

**Comment by be-engineer** [comment]
我用mihomo做透明网关也遇到这个问题了，只要打开tun模式，外网就无法访问内网的服务，关闭tun就可以，但是关闭tun模式代理又失效，有没有什么办法可以解决？

**Comment by be-engineer** [comment]
> > 我暂时把docker container改为host了
> 
> 我暂时跑了tproxy模式，其实tproxy效率还更好一些。

mihomo怎么配置tproxy模式？

**Comment by zbs4017** [comment]
请问有什么好的解决方案吗？我跟踪了流量，在tun上面发现了一个rst包，但是在客户端上我没有接收到。
11:38:17.262080 IP (tos 0x0, ttl 63, id 15272, offset 0, flags [DF], proto TCP (6), length 40)
    10.252.1.33.7860 > 10.252.2.13.11196: Flags [F.], cksum 0x0b24 (correct), seq 2567078985, ack 2460389170, win 501, length 0
11:38:17.262318 IP (tos 0x0, ttl 64, id 0, offset 0, flags [DF], proto TCP (6), length 40)
    10.252.2.13.11166 > 10.252.1.33.7860: Flags [R], cksum 0x4a56 (correct), seq 2163573021, win 0, length 0
    可以看到两次客户端的端口号都变了，所以我猜测可能这个rst包应该是tun产生的，

**Comment by 2018wzh** [comment]
我这边把内网接口放在exclude-interface里面就好了

**Comment by chenzhenjia** [comment]
请问有解决方案吗，我现在在linux上做网关也出现这个问题了，另外一台服务器只要把网关改为mihomo，上面的服务就不能在外网访问了，关了tun就可以

**Comment by Journalist-HK** [comment]
我现在是关闭 auto-route，把要访问的端口 return 掉，剩下标记过的流量路由到 tun 网卡

```
# 还有 MAC 和国内 IP 段的 set 这里省略

set bypass_services {
    type inet_proto . inet_service
    flags interval
    auto-merge
    elements = {
        udp . 3544, # Teredo
        udp . 51820  # WireGuard
    }
}

 chain mangle_prerouting_custom {
    type filter hook prerouting priority mangle - 1; policy accept;
    # 1. Do not touch packets from direct-to-wan devices.
    ether saddr @direct_macs counter return
    # 2. Bypass local connections.
    ip daddr @local_ipv4 counter return
    ip6 daddr @local_ipv6 counter return
    # 3. Bypass specific services.
    iifname "br-lan" ip saddr @local_ipv4 meta l4proto . th sport @bypass_services counter return
    iifname "br-lan" ip6 saddr @local_ipv6 meta l4proto . th sport @bypass_services counter return
    # 4. Bypass Chinese addresses.
    ip daddr @chnroute return
    ip6 daddr @chnroute6 return
    # 4. Mark all remaining packets and route them to TUN dev.
    iifname "br-lan" meta l4proto {tcp, udp} counter meta mark set $tun_mark return
}                                                

```
参考：https://github.com/lirundong/homelab-infra/blob/master/openwrt-builder/files/etc/nftables.d/99-sing-box.nft

**Comment by Journalist-HK** [comment]
> > 我现在是关闭 auto-route，把要访问的端口 return 掉，剩下标记过的流量路由到 tun 网卡
> > ```
> > # 还有 MAC 和国内 IP 段的 set 这里省略
> > 
> > set bypass_services {
> >     type inet_proto . inet_service
> >     flags interval
> >     auto-merge
> >     elements = {
> >         udp . 3544, # Teredo
> >         udp . 51820  # WireGuard
> >     }
> > }
> > 
> > chain mangle_prerouting_custom {
> >     type filter hook prerouting priority mangle - 1; policy accept;
> >     # 1. Do not touch packets from direct-to-wan devices.
> >     ether saddr @direct_macs counter return
> >     # 2. Bypass local connections.
> >     ip daddr @local_ipv4 counter return
> >     ip6 daddr @local_ipv6 counter return
> >     # 3. Bypass specific services.
> >     iifname "br-lan" ip saddr @local_ipv4 meta l4proto . th sport @bypass_services counter return
> >     iifname "br-lan" ip6 saddr @local_ipv6 meta l4proto . th sport @bypass_services counter return
> >     # 4. Bypass Chinese addresses.
> >     ip daddr @chnroute return
> >     ip6 daddr @chnroute6 return
> >     # 4. Mark all remaining packets and route them to TUN dev.
> >     iifname "br-lan" meta l4proto {tcp, udp} counter meta mark set $tun_mark return
> > }
> > ```
> > 
> > 
> >     
> >       
> >     
> > 
> >       
> >     
> > 
> >     
> >   
> > 参考：https://github.com/lirundong/homelab-infra/blob/master/openwrt-builder/files/etc/nftables.d/99-sing-box.nft
> 
> 谢谢你的配置，我试过了一下这个配置，我在nftables里面的配置，然后tun.auto-route: false 之后入站确实可以了，但是只要是配置到网关的机器都不能访问外网了。请问是什么问题呢？ nftables
> 
> ```
>   chain proxy {
>     ip daddr @local_ipv4 counter return
>     # 3. Bypass specific services.
>     iifname "eth0" ip saddr @local_ipv4 meta l4proto . th sport @bypass_services counter return
> #    iifname "eth0" ip saddr @local_ipv4 th sport @bypass_services counter return
>     ip protocol tcp redirect to :7892
>   }
> ```
> 
> mihomo
> 
> ```
> tun:
>   enable: true
>   stack: system
>   dns-hijack:
>     - any:53
>   auto-route: false
>   auto-redirect: true
>   auto-redir: true
>   auto-detect-interface: true
> ```

DNS要单独处理 https://v2ex.com/t/999172#reply22

**Comment by chenzhenjia** [comment]
> > > 我现在是关闭 auto-route，把要访问的端口 return 掉，剩下标记过的流量路由到 tun 网卡
> > > ```
> > > # 还有 MAC 和国内 IP 段的 set 这里省略
> > > 
> > > set bypass_services {
> > >     type inet_proto . inet_service
> > >     flags interval
> > >     auto-merge
> > >     elements = {
> > >         udp . 3544, # Teredo
> > >         udp . 51820  # WireGuard
> > >     }
> > > }
> > > 
> > > chain mangle_prerouting_custom {
> > >     type filter hook prerouting priority mangle - 1; policy accept;
> > >     # 1. Do not touch packets from direct-to-wan devices.
> > >     ether saddr @direct_macs counter return
> > >     # 2. Bypass local connections.
> > >     ip daddr @local_ipv4 counter return
> > >     ip6 daddr @local_ipv6 counter return
> > >     # 3. Bypass specific services.
> > >     iifname "br-lan" ip saddr @local_ipv4 meta l4proto . th sport @bypass_services counter return
> > >     iifname "br-lan" ip6 saddr @local_ipv6 meta l4proto . th sport @bypass_services counter return
> > >     # 4. Bypass Chinese addresses.
> > >     ip daddr @chnroute return
> > >     ip6 daddr @chnroute6 return
> > >     # 4. Mark all remaining packets and route them to TUN dev.
> > >     iifname "br-lan" meta l4proto {tcp, udp} counter meta mark set $tun_mark return
> > > }
> > > ```
> > > 
> > > 
> > >     
> > >       
> > >     
> > > 
> > >       
> > >     
> > > 
> > >     
> > >   
> > > 参考：https://github.com/lirundong/homelab-infra/blob/master/openwrt-builder/files/etc/nftables.d/99-sing-box.nft
> > 
> > 
> > 谢谢你的配置，我试过了一下这个配置，我在nftables里面的配置，然后tun.auto-route: false 之后入站确实可以了，但是只要是配置到网关的机器都不能访问外网了。请问是什么问题呢？ nftables
> > ```
> >   chain proxy {
> >     ip daddr @local_ipv4 counter return
> >     # 3. Bypass specific services.
> >     iifname "eth0" ip saddr @local_ipv4 meta l4proto . th sport @bypass_services counter return
> > #    iifname "eth0" ip saddr @local_ipv4 th sport @bypass_services counter return
> >     ip protocol tcp redirect to :7892
> >   }
> > ```
> > 
> > 
> >     
> >       
> >     
> > 
> >       
> >     
> > 
> >     
> >   
> > mihomo
> > ```
> > tun:
> >   enable: true
> >   stack: system
> >   dns-hijack:
> >     - any:53
> >   auto-route: false
> >   auto-redirect: true
> >   auto-redir: true
> >   auto-detect-interface: true
> > ```
> 
> DNS要单独处理 https://v2ex.com/t/999172#reply22

还是不行，这是我的clash.nft整个配置文件，可以帮忙看看吗

```
#!/usr/sbin/nft -f

flush ruleset
define dns_mark      = 0x03
define tun_mark      = 0x02
define tun_route_ip  =  198.18.0.1
table ip nat {
  set bypass_services {
    type inet_proto . inet_service
    flags interval
    auto-merge
    elements = {
       tcp . 9200
    }
}
set local_ipv4 {
    type ipv4_addr
    flags interval
    auto-merge
    elements = {
        0.0.0.0/8,
        10.0.0.0/8,
        127.0.0.0/8,
        169.254.0.0/16,
        172.16.0.0/12,
        192.168.0.0/16,
        224.0.0.0/4,
        240.0.0.0/4
    }
}


  chain proxy {
    iifname "eth0" ip saddr @local_ipv4 meta l4proto . th sport @bypass_services counter return
    iifname "eth0" meta l4proto {tcp, udp} th dport 53 counter meta mark set $dns_mark return
    ip daddr @local_ipv4 counter return
    iifname "eth0" meta l4proto {tcp, udp} counter meta mark set $tun_mark return
#    iifname "eth0" ip saddr @local_ipv4 th sport @bypass_services counter return
    ip protocol tcp redirect to :7892
  }


  chain prerouting {
    type nat hook prerouting priority 0; policy accept;
    jump proxy
  }
chain dstnat_lan_custom {
    type nat hook prerouting priority dstnat - 1; policy accept;
    # 1. Finally, take care of DNS packets.
    meta mark $dns_mark counter dnat ip to $tun_route_ip
}

  chain output {
        type nat hook output priority 100; policy accept;
        meta skgid eq 23333 counter return

       ct mark 11 counter return

  }


}
```

**Comment by itanxiao** [comment]
找到解决方案了，禁用mihomo的nat ，然后让nftables转发流量，可以参照他的配置来，这样mihomo可以做网关也外网访问内网
https://www.arloor.com/posts/clash-tpproxy/

**Comment by elvizlai** [comment]
exclude-interface 这个并不完全奏效，比如排除 docker0，然后你会发现开启 container 访问网络的时候域名解析的是一个内网 192.168.0.x 的内网ip，因为被排除了，所以请求都无法发起

**Comment by uuip** [comment]
https://github.com/SagerNet/sing-tun/issues/42
https://github.com/MetaCubeX/mihomo/issues/1963
都是一个问题。建议大佬们一起研究。singbox说是已经解决了这个问题

**Comment by openainext** [comment]
没人搞啊

**Comment by srlihg66** [comment]
docker外网玩不了 cf522 关闭就好了 好难受浪费很多时间

**Comment by srlihg66** [comment]
https://github.com/scenery/mihomo-tproxy-docker/tree/main 用了这个 透明代理docker 我使用host网络 都正常了

**Comment by elvizlai** [comment]
> https://github.com/scenery/mihomo-tproxy-docker/tree/main 用了这个 透明代理docker 我使用host网络 都正常了

可能不是一个问题，只让 docker 不走代理的话，官方配置里忽略对应的网卡或网段就好了。大多数情况下需要面对的问题是：不要代理 172.17.0.0/24（掩码可能会扩大），但是 容器里 的网络请求需要被代理（比如有gist或被block的资源需要代理）

另外，如果 docker 使用 host网络 的话，好像都不需要额外配置。而且这个时候，已经失去了一部分docker的优势了。。。毕竟很难保证，所有容器的端口都不冲突

勉强能用的方案或者方法有蛮多的，目前暂时没发现比较优雅的方法。

**Comment by srlihg66** [comment]
> > https://github.com/scenery/mihomo-tproxy-docker/tree/main用了这个透明代理docker 我使用host网络都正常了
> 
> 可能不是一个问题，只要让 docker 不走代理的话，官方配置里忽略对应的拦截或网段就好了。大多数情况下需要的问题是：不要代理 172.17.0.0/24（掩码可能会扩大），但是容器里的网络请求需要被代理（比如有要点或被屏蔽的资源需要代理）

官方那些配置没有用 不管是排除网卡 还是排除相关ip段 他会自动生成一些规则 但是无效 只能用透明代理 相关问题很多 都不行的 反正我改成透明代理  又能上网又不影响任何外部通信 跑docker一秒 还能当旁路由 设置网关局域网也能用
