### ISSUE TITLE
android的tun模式无法连接miui+

### ISSUE THREAD

**Issue by vumb5j** [MetaCubeX/mihomo#257]
设备：红米k30s，MIUI13.0.6
描述：通过MIUI+从电脑（win系统）连接手机，显示超时
版本：最新Alpha版

（备注：MIUI+指 [https://plus.miui.com/](https://plus.miui.com/) ）

通过tcpdump抓包连接过程对比如下：

正常连接：
```
14:34:50.124814 IP 192.168.50.225.mdns > 224.0.0.251.mdns: 0*- [0q] 8/0/4 (Cache flush) TXT "idHash=NzFh^J" "dev=1" "sec=2" "apps=[8194]" "name=Redmi K30S Ultra" "flags=Ag==^J" "version=65544" "commonData=0" "appsData=AQIEgw==^J", PTR _mi-connect._udp.local., PTR {"nm":"Redmi K30S Ultra","as":"[8194]","ip":"225"}._mi-connect._udp.local., (Cache flush) SRV Android.local.:56666 0 0, (Cache flush) PTR Android.local., (Cache flush) PTR Android.local., (Cache flush) A 192.168.50.225, (Cache flush) AAAA fe80::dc33:e3ff:fef8:31b (550)
14:34:50.125380 IP6 fe80::dc33:e3ff:fef8:31b.mdns > ff02::fb.mdns: 0*- [0q] 8/0/4 (Cache flush) TXT "idHash=NzFh^J" "dev=1" "sec=2" "apps=[8194]" "name=Redmi K30S Ultra" "flags=Ag==^J" "version=65544" "commonData=0" "appsData=AQIEgw==^J", PTR _mi-connect._udp.local., PTR {"nm":"Redmi K30S Ultra","as":"[8194]","ip":"225"}._mi-connect._udp.local., (Cache flush) SRV Android.local.:56666 0 0, (Cache flush) PTR Android.local., (Cache flush) PTR Android.local., (Cache flush) A 192.168.50.225, (Cache flush) AAAA fe80::dc33:e3ff:fef8:31b (550)   14:34:51.694915 IP 192.168.50.247.mdns > 224.0.0.251.mdns: 0 PTR (QM)? _googlecast._tcp.local. (40)
14:34:51.695154 IP 192.168.50.247.mdns > 224.0.0.251.mdns: 0 PTR (QM)? _googlecast._tcp.local. (40)
14:34:51.695189 IP6 fe80::e254:463f:16d2:fca2.mdns > ff02::fb.mdns: 0 PTR (QM)? _googlecast._tcp.local. (40)
14:34:51.695291 IP6 fe80::e254:463f:16d2:fca2.mdns > ff02::fb.mdns: 0 PTR (QM)? _googlecast._tcp.local. (40)
14:34:51.695740 IP 192.168.50.247.mdns > 224.0.0.251.mdns: 0 PTR (QM)? _googlecast._tcp.local. (40)
14:34:51.695843 IP 192.168.50.247.mdns > 224.0.0.251.mdns: 0 PTR (QM)? _googlecast._tcp.local. (40)
14:34:51.695876 IP6 fe80::e254:463f:16d2:fca2.mdns > ff02::fb.mdns: 0 PTR (QM)? _googlecast._tcp.local. (40)
14:34:51.696466 IP6 fe80::e254:463f:16d2:fca2.mdns > ff02::fb.mdns: 0 PTR (QM)? _googlecast._tcp.local. (40)
14:34:52.028385 IP 192.168.50.225.mdns > 224.0.0.251.mdns: 0 [1a] PTR (QM)? _mi-connect._udp.local. (114)
14:34:52.029522 IP6 fe80::dc33:e3ff:fef8:31b.mdns > ff02::fb.mdns: 0 [1a] PTR (QM)? _mi-connect._udp.local. (114)
14:34:52.128936 IP 192.168.50.225.mdns > 224.0.0.251.mdns: 0*- [0q] 8/0/4 (Cache flush) TXT "idHash=NzFh^J" "dev=1" "sec=2" "apps=[8194]" "name=Redmi K30S Ultra" "flags=Ag==^J" "version=65544" "commonData=0" "appsData=AQIEgw==^J", PTR _mi-connect._udp.local., PTR {"nm":"Redmi K30S Ultra","as":"[8194]","ip":"225"}._mi-connect._udp.local., (Cache flush) SRV Android.local.:56666 0 0, (Cache flush) PTR Android.local., (Cache flush) PTR Android.local., (Cache flush) A 192.168.50.225, (Cache flush) AAAA fe80::dc33:e3ff:fef8:31b (550)
14:34:52.129425 IP6 fe80::dc33:e3ff:fef8:31b.mdns > ff02::fb.mdns: 0*- [0q] 8/0/4 (Cache flush) TXT "idHash=NzFh^J" "dev=1" "sec=2" "apps=[8194]" "name=Redmi K30S Ultra" "flags=Ag==^J" "version=65544" "commonData=0" "appsData=AQIEgw==^J", PTR _mi-connect._udp.local., PTR {"nm":"Redmi K30S Ultra","as":"[8194]","ip":"225"}._mi-connect._udp.local., (Cache flush) SRV Android.local.:56666 0 0, (Cache flush) PTR Android.local., (Cache flush) PTR Android.local., (Cache flush) A 192.168.50.225, (Cache flush) AAAA fe80::dc33:e3ff:fef8:31b (550)
```

开tun后：
```
tcpdump: verbose output suppressed, use -v or -vv for full protocol decode
listening on Meta, link-type RAW (Raw IP), capture size 262144 bytes
14:42:38.947558 IP6 fe80::d3aa:6c86:9ff1:bca6 > ff02::2: ICMP6, router solicitation, length 8
14:42:43.149025 IP 198.18.0.1.47085 > 192.168.137.1.55683: UDP, length 46
14:42:43.150628 IP 198.18.0.1.9281 > 192.168.50.1.domain: 45762+ PTR? 1.0.18.198.in-addr.arpa. (41)
14:42:43.151243 IP 198.18.0.1 > 192.168.137.1: ICMP echo request, id 59, seq 1, length 64
14:42:43.151897 IP 192.168.137.1 > 198.18.0.1: ICMP echo reply, id 59, seq 1, length 64
14:42:43.152358 IP 192.168.50.1.domain > 198.18.0.1.9281: 45762 NXDomain* 0/1/1 (106)
14:42:43.154113 IP 198.18.0.1.42798 > 192.168.137.1.1234: Flags [S], seq 277779622, win 65535, options [mss 8960,sackOK,TS val 262325212 ecr 0,nop,wscale 9], length 0
14:42:43.154183 IP 198.18.0.2.10002 > 198.18.0.1.42781: Flags [S], seq 277779622, win 65535, options [mss 8960,sackOK,TS val 262325212 ecr 0,nop,wscale 9], length 0
14:42:43.154278 IP 198.18.0.1.42781 > 198.18.0.2.10002: Flags [S.], seq 2842988386, ack 277779623, win 65535, options [mss 8960,sackOK,TS val 938274161 ecr 262325212,nop,wscale 9], length 0
14:42:43.172391 IP 198.18.0.1.52363 > 192.168.50.1.domain: 41653+ PTR? 1.50.168.192.in-addr.arpa. (43)
14:42:43.175235 IP 198.18.0.1 > 192.168.137.1: ICMP echo request, id 60, seq 1, length 64
14:42:43.175341 IP 192.168.137.1 > 198.18.0.1: ICMP echo reply, id 60, seq 1, length 64
14:42:43.175858 IP 198.18.0.1.47445 > 192.168.50.1.domain: 64068+ PTR? 2.0.18.198.in-addr.arpa. (41)
14:42:43.177027 IP 192.168.50.1.domain > 198.18.0.1.47445: 64068 NXDomain* 0/1/1 (106)
14:42:43.192736 IP 198.18.0.1 > 192.168.137.1: ICMP echo request, id 61, seq 1, length 64
14:42:43.192877 IP 192.168.137.1 > 198.18.0.1: ICMP echo reply, id 61, seq 1, length 64
14:42:43.209067 IP 198.18.0.1 > 192.168.137.1: ICMP echo request, id 62, seq 1, length 64
14:42:43.209188 IP 192.168.137.1 > 198.18.0.1: ICMP echo reply, id 62, seq 1, length 64
14:42:43.223070 IP 198.18.0.1 > 192.168.137.1: ICMP echo request, id 63, seq 1, length 64
14:42:43.223274 IP 192.168.137.1 > 198.18.0.1: ICMP echo reply, id 63, seq 1, length 64
14:42:43.653416 IP 198.18.0.1.47085 > 192.168.137.1.55683: UDP, length 46
14:42:43.801711 IP 198.18.0.1.55683 > 192.168.137.1.58804: UDP, length 4
14:42:43.811206 IP 198.18.0.1.56666 > 192.168.137.1.58805: UDP, length 119
14:42:44.154550 IP 198.18.0.1.47085 > 192.168.137.1.55683: UDP, length 46
14:42:44.233131 IP 198.18.0.1.55683 > 192.168.137.1.58804: UDP, length 4
14:42:44.234214 IP 198.18.0.1.56666 > 192.168.137.1.58805: UDP, length 119
14:42:44.655648 IP 198.18.0.1.47085 > 192.168.137.1.55683: UDP, length 46
14:42:44.733473 IP 198.18.0.1.56666 > 192.168.137.1.58805: UDP, length 119
14:42:44.746261 IP 198.18.0.1.55683 > 192.168.137.1.58804: UDP, length 4
14:42:45.231748 IP 198.18.0.1.56666 > 192.168.137.1.58805: UDP, length 119
```

**Comment by reeceyng** [comment]
我也在使用miui+，试了一下是可以连上的，把miui+的应用排除在代理应用之外了吗？

**Comment by vumb5j** [comment]
> 我也在使用miui+，试了一下是可以连上的，把miui+的应用排除在代理应用之外了吗？

你用的是cmfa app还是纯内核？我这边用纯内核是跑不通的

**Comment by xishang0128** [comment]
考虑到这个 issues 没有使用正确的模板格式，我们决定关闭它。 
 
如果你有需要请遵守模版开启新的 issues。
 
Considering that this issue did not use the correct template format, we decided to close it. 
 
If you need to, please follow the template to open new issues.
