### ISSUE TITLE
[Bug]OpenWrt 使用 Tunnel 模式并作为网关时无法转发 UDP 流量

### ISSUE THREAD

**Issue by haeho7** [MetaCubeX/mihomo#2584]
### 验证步骤

- [x] 我已经阅读了 [文档](https://wiki.metacubex.one/)，了解所有我编写的配置文件项的含义，而不是大量堆砌看似有用的选项或默认值。
- [x] 我仔细看过 [文档](https://wiki.metacubex.one/) 并未解决问题
- [x] 我已在 [Issue Tracker](……/) 中寻找过我要提出的问题，并且没有找到
- [x] 我是中文用户，而非其他语言用户
- [x] 我已经使用最新的 Alpha 分支版本测试过，问题依旧存在
- [x] 我提供了可以在本地重现该问题的服务器、客户端配置文件与流程，而不是一个脱敏的复杂客户端配置文件。
- [x] 我提供了可用于重现我报告的错误的最简配置，而不是依赖远程服务器或者堆砌大量对于复现无用的配置等。
- [x] 我提供了完整的日志，而不是出于对自身智力的自信而仅提供了部分认为有用的部分。
- [x] 我直接使用 Mihomo 命令行程序重现了错误，而不是使用其他工具或脚本。

### 操作系统

Linux

### 系统版本

OpenWrt 21.02.3 r16577

### Mihomo 版本

Mihomo Meta alpha-f6722ab linux amd64 with go1.26.0 Wed Feb 25 05:17:06 UTC 2026
Use tags: with_gvisor

Mihomo Meta v1.19.20 linux amd64 with go1.25.7 Sun Feb  8 13:59:19 UTC 2026
Use tags: with_gvisor （二进制和 Docker 版本均测试过）

### 配置文件

```yaml
#port: 7890
#socks-port: 7891
mixed-port: 7892
#redir-port: 7893
#tproxy-port: 7894
log-level: debug
mode: rule
ipv6: true
allow-lan: true
bind-address: "*"
unified-delay: true
tcp-concurrent: true
find-process-mode: off
disable-keep-alive: false
keep-alive-idle: 600
keep-alive-interval: 15
profile:
  store-selected: true
  store-fake-ip: true

geodata-mode: true
geodata-loader: standard
geosite-matcher: succinct
geo-auto-update: true
geo-update-interval: 24
geox-url:
  geoip: "https://testingcf.jsdelivr.net/gh/MetaCubeX/meta-rules-dat@release/geoip.dat"
  geosite: "https://testingcf.jsdelivr.net/gh/MetaCubeX/meta-rules-dat@release/geosite.dat"
  mmdb: "https://testingcf.jsdelivr.net/gh/MetaCubeX/meta-rules-dat@release/country.mmdb"

external-controller: 192.168.1.1:9090
external-controller-tls: ""
secret: "admin@123"

proxies:
  - name: SS-SJC
    type: ss
    server: 10.1.10.1
    port: 1984
    cipher: 2022-blake3-aes-128-gcm
    password: <Password>
    ip-version: ipv4-prefer
    # 走 tinyfecvpn 接口
    interface-name: tfvpn-sjc
    udp: true
    udp-over-tcp: false
    udp-over-tcp-version: 2
    tfo: true
    mptcp: false

tun:
  enable: true
  #stack: system
  #device: mihomo
  #mtu: 1500
  #gso: true
  #gso-max-size: 65536
  udp-timeout: 300
  #strict-route: true
  auto-route: true
  auto-redirect: true
  auto-detect-interface: true
  endpoint-independent-nat: false
  disable-icmp-forwarding: false
  # 排除 VPS 地址
  route-exclude-address:
    # vps
    - XX.XX.XX.XX/32
  #dns-hijack:
  #  - udp://any:53
  #  - tcp://any:53

dns:
  enable: true
  listen: 0.0.0.0:5353
  cache-algorithm: arc
  respect-rules: true
  prefer-h3: false
  ipv6: true
  ipv6-timeout: 300
  enhanced-mode: redir-host
  proxy-server-nameserver:
    - tls://120.53.53.53:853
    - tls://223.5.5.5:853
  default-nameserver:
    - tls://120.53.53.53:853
    - tls://223.5.5.5:853
  nameserver:
    - https://223.5.5.5/dns-query
    - https://doh.pub/dns-query
  nameserver-policy:
    'geosite:private,apple@cn,microsoft@cn,category-games@cn,geolocation-cn':
      - https://223.5.5.5/dns-query
      - https://doh.pub/dns-query
    'geosite:!cn':
      - https://dns.google/dns-query

  direct-nameserver-follow-policy: false
  fallback:
    - https://dns.google/dns-query
  fallback-filter:
    geoip: true
    geoip-code: CN
    geosite:
      - gfw

proxy-groups:
  - name: PROXY
    type: select
    proxies:
      - SS-SJC

rules:
  - GEOIP,CN,DIRECT,no-resolve
  - GEOSITE,geolocation-cn,DIRECT
  - MATCH,PROXY
```

### 描述

OpenWrt 作为局域网的网关设备，同时部署 Mihomo 并开启 Tunnel 模式后，除 Mihomo 所在设备自身（即 OpenWrt）以外，局域网下其他的客户端无法使用任意 UDP 协议，Mihomo 中也没有相关 UDP 的日志。
 

具体现象如下:

- 开启 Tunnel 模式后，OpenWrt 自身可以使用 UDP 相关协议，如 NTP、Wireguard 等；
- 开启 Tunnel 模式后，局域网下的其他客户端无法使用任意 UDP 协议；
- 关闭 Tunnel 模式或者直接停止 Mihomo 后，局域网下的其他客户端使用任意 UDP 协议正常；

参考了这两个 issues 进行调整，问题依旧:

- https://github.com/MetaCubeX/mihomo/issues/1632
- https://github.com/MetaCubeX/mihomo/issues/1866

### Mihomo 停止或关闭 Tunnel 模式时的现象

OpenWrt 路由策略:

```sh
root@OpenWrt:~# ip rule
0:      from all lookup local
32766:  from all lookup main
32767:  from all lookup default
```

局域网其他客户端使用 `netcat` 工具进行测试，访问正常:

```sh
root@ARCH-O1 ~ # nc -4uv www.qq.com 443
Connection to www.qq.com (121.14.77.201) 443 port [udp/https] succeeded!

root@ARCH-O1 ~ # nc -4uv www.qq.com 1080
Connection to www.qq.com (121.14.77.201) 1080 port [udp/socks] succeeded!

root@ARCH-O1 ~ # nc -6uv www.qq.com 443
Connection to www.qq.com (240e:97c:2f:2::4c) 443 port [udp/https] succeeded!

root@ARCH-O1 ~ # nc -6uv www.qq.com 1080
Connection to www.qq.com (240e:97c:2f:2::4c) 1080 port [udp/socks] succeeded!
```

局域网其他客户端使用 `ntpdate` 工具进行测试，访问正常:

```sh
root@ARCH-O1 ~ # ntpdate -d 1.cn.pool.ntp.org
26 Feb 22:31:30 ntpdate[3521]: ntpdate 4.2.8p18@1.4062-o Thu Oct 23 00:08:33 UTC 2025 (1)
Looking for host 1.cn.pool.ntp.org and service ntp
host found : 111.230.189.174
transmit(111.230.189.174)
receive(111.230.189.174)
transmit(139.199.214.202)
receive(139.199.214.202)
transmit(185.209.85.222)
receive(185.209.85.222)
transmit(84.16.73.33)
transmit(111.230.189.174)
receive(111.230.189.174)
transmit(139.199.214.202)
receive(139.199.214.202)
transmit(185.209.85.222)
receive(185.209.85.222)
transmit(84.16.73.33)
transmit(111.230.189.174)
receive(111.230.189.174)
transmit(139.199.214.202)
receive(139.199.214.202)
transmit(185.209.85.222)
transmit(84.16.73.33)
transmit(111.230.189.174)
receive(111.230.189.174)
transmit(139.199.214.202)
receive(139.199.214.202)
transmit(185.209.85.222)
receive(185.209.85.222)
transmit(84.16.73.33)
receive(84.16.73.33)

server 111.230.189.174, port 123
stratum 2, precision -23, leap 00, trust 000
refid [100.122.36.196], root delay 0.002121, root dispersion 0.017975
reference time:      ed4ad79f.6742fe84  Thu, Feb 26 2026 22:30:55.403
originate timestamp: ed4ad7c8.9e266780  Thu, Feb 26 2026 22:31:36.617
transmit timestamp:  ed4ad7c8.9e358406  Thu, Feb 26 2026 22:31:36.618
filter delay:  0.03712    0.03622    0.03586    0.03636   
               ----       ----       ----       ----      
filter offset: -0.005298  -0.005285  -0.005613  -0.005617 
               ----       ----       ----       ----      
delay 0.03586, dispersion 0.00018, offset -0.005613

server 139.199.214.202, port 123
stratum 2, precision -23, leap 00, trust 000
refid [100.122.36.196], root delay 0.000061, root dispersion 0.030884
reference time:      ed4ad4cc.9ffa28db  Thu, Feb 26 2026 22:18:52.624
originate timestamp: ed4ad7c8.d125529b  Thu, Feb 26 2026 22:31:36.816
transmit timestamp:  ed4ad7c8.d1674f0d  Thu, Feb 26 2026 22:31:36.817
filter delay:  0.03386    0.03354    0.03334    0.03342   
               ----       ----       ----       ----      
filter offset: -0.005207  -0.004646  -0.005012  -0.004922 
               ----       ----       ----       ----      
delay 0.03334, dispersion 0.00015, offset -0.005012

server 185.209.85.222, port 123
stratum 2, precision -25, leap 00, trust 000
refid [130.173.91.58], root delay 0.001770, root dispersion 0.000458
reference time:      ed4ad6c8.b00de0be  Thu, Feb 26 2026 22:27:20.687
originate timestamp: ed4ad7c9.14252f8a  Thu, Feb 26 2026 22:31:37.078
transmit timestamp:  ed4ad7c9.049a8262  Thu, Feb 26 2026 22:31:37.017
filter delay:  0.20815    0.20834    0.00000    0.20612   
               ----       ----       ----       ----      
filter offset: -0.031317  -0.032136  +0.000000  -0.031452 
               ----       ----       ----       ----      
delay 0.20612, dispersion 8.00023, offset -0.031452

server 84.16.73.33, port 123
stratum 1, precision -23, leap 00, trust 000
refid [GPS], root delay 0.000015, root dispersion 0.000031
reference time:      ed4ad7bc.e1a35085  Thu, Feb 26 2026 22:31:24.881
originate timestamp: ed4ad7c9.4f569c37  Thu, Feb 26 2026 22:31:37.309
transmit timestamp:  ed4ad7c9.37e136b4  Thu, Feb 26 2026 22:31:37.218
filter delay:  0.00000    0.00000    0.00000    0.22154   
               ----       ----       ----       ----      
filter offset: +0.000000  +0.000000  +0.000000  -0.007926 
               ----       ----       ----       ----      
delay 0.22154, dispersion 56.00000, offset -0.007926

26 Feb 22:31:37 ntpdate[3521]: adjust time server 84.16.73.33 offset -0.007926 sec
```

### Mihomo 启用 Tunnel 模式时的现象

OpenWrt 路由策略:

```sh
root@OpenWrt:~# ip rule
0: from all lookup local
9000: from all to 198.18.0.0/30 lookup 2022
9001: not from all dport 53 lookup main suppress_prefixlength 0
9001: from all iif Meta goto 9010
9002: not from all iif lo lookup 2022
9002: from 0.0.0.0 iif lo lookup 2022
9002: from 198.18.0.0/30 iif lo lookup 2022
9010: from all nop
32766: from all lookup main
32767: from all lookup default
```

局域网其他客户端使用 `netcat` 工具进行测试，访问异常。并且 Mihomo 中只有该域名的 DNS 请求日志，并未出现 UDP 相关的日志:

```sh
root@ARCH-O1 ~ # nc -4uv www.qq.com 1080
root@ARCH-O1 ~ # 
root@ARCH-O1 ~ # nc -6uv www.qq.com 1080
root@ARCH-O1 ~ # 
root@ARCH-O1 ~ # nc -4uv www.qq.com 443
root@ARCH-O1 ~ # 
root@ARCH-O1 ~ # nc -6uv www.qq.com 443
```

```log
mihomo  | time="2026-02-26T21:15:29.601759423+08:00" level=debug msg="[DNS] resolve www.qq.com A from https://doh.pub:443/dns-query"
mihomo  | time="2026-02-26T21:15:29.601918641+08:00" level=debug msg="[DNS] resolve www.qq.com A from https://223.5.5.5:443/dns-query"
mihomo  | time="2026-02-26T21:15:29.602222028+08:00" level=debug msg="[Rule] use default rules"
mihomo  | time="2026-02-26T21:15:29.604086186+08:00" level=debug msg="[TUN] Auto detect interface for 223.5.5.5 --> pppoe-wan"
mihomo  | time="2026-02-26T21:15:29.612473723+08:00" level=info msg="[TCP] mihomo --> 223.5.5.5:443 match GeoIP(cn) using DIRECT"
mihomo  | time="2026-02-26T21:15:29.614883496+08:00" level=debug msg="[DNS] www.qq.com --> [121.14.77.221 121.14.77.201] A from https://doh.pub:443/dns-query"

mihomo  | time="2026-02-26T21:16:31.035956813+08:00" level=debug msg="[DNS] resolve www.qq.com AAAA from https://doh.pub:443/dns-query"
mihomo  | time="2026-02-26T21:16:31.036259117+08:00" level=debug msg="[DNS] resolve www.qq.com AAAA from https://223.5.5.5:443/dns-query"
mihomo  | time="2026-02-26T21:16:31.036404563+08:00" level=debug msg="[Rule] use default rules"
mihomo  | time="2026-02-26T21:16:31.038131434+08:00" level=debug msg="[TUN] Auto detect interface for 223.5.5.5 --> pppoe-wan"
mihomo  | time="2026-02-26T21:16:31.046858209+08:00" level=info msg="[TCP] mihomo --> 223.5.5.5:443 match GeoIP(cn) using DIRECT"
mihomo  | time="2026-02-26T21:16:31.048718838+08:00" level=debug msg="[DNS] www.qq.com --> [240e:97c:2f:1::5c 240e:97c:2f:2::4c] AAAA from https://doh.pub:443/dns-query"
```

局域网其他客户端使用 `ntpdate` 工具进行测试，访问异常:

```sh
root@ARCH-O1 ~ # ntpdate -d 1.cn.pool.ntp.org
26 Feb 22:37:37 ntpdate[3540]: ntpdate 4.2.8p18@1.4062-o Thu Oct 23 00:08:33 UTC 2025 (1)
Looking for host 1.cn.pool.ntp.org and service ntp
host found : 111.230.189.174
transmit(111.230.189.174)
transmit(139.199.214.202)
transmit(185.209.85.222)
transmit(84.16.73.33)
transmit(111.230.189.174)
transmit(139.199.214.202)
transmit(185.209.85.222)
transmit(84.16.73.33)
transmit(111.230.189.174)
transmit(139.199.214.202)
transmit(185.209.85.222)
transmit(84.16.73.33)
transmit(111.230.189.174)
transmit(139.199.214.202)
transmit(185.209.85.222)
transmit(84.16.73.33)
111.230.189.174: Server dropped: no data
139.199.214.202: Server dropped: no data
185.209.85.222: Server dropped: no data
84.16.73.33: Server dropped: no data

26 Feb 22:37:46 ntpdate[3540]: no server suitable for synchronization found
```

OpenWrt 自身的 UDP 流量:

![Image](https://github.com/user-attachments/assets/a8f9b8b4-c676-4e5e-8bc5-2a53ac0fba84)

![Image](https://github.com/user-attachments/assets/7e13d1be-ed15-4072-872e-67c49c95bb81)

### 重现方式

采用上方的 Mihomo 配置文件，使用 Mihomo 二进制文件或 Docker 镜像在 OpenWrt 中进行启动:

```yml
services:
  mihomo:
    image: metacubex/mihomo:v1.19.20
    #image: metacubex/mihomo:Alpha
    container_name: mihomo
    restart: unless-stopped
    network_mode: host
    privileged: true
    #pid: host
    #ipc: host
    cap_add:
      - NET_ADMIN
    devices:
      - /dev/net/tun:/dev/net/tun
    logging:
      options:
        max-file: 1
        max-size: 20m
    environment:
      TZ: Asia/Taipei
    volumes:
      - ./mihomo-data:/etc/mihomo
    command: -d /etc/mihomo

  zashboard:
    image: haeho7/docker-images:zashboard
    container_name: zashboard
    restart: unless-stopped
    network_mode: host
    logging:
      options:
        max-file: 1
        max-size: 20m
    environment:
      TZ: Asia/Taipei
      ZASHBOARD_PORT: 9091
```

### 日志

```shell
如上
```

**Comment by haeho7** [comment]
目前临时的处理方式：

在 Mihomo 开启 Tunnel 模式时，添加自定义路由策略，让 Mihomo 跳过劫持 UDP 流量，局域网下的其他客户端使用 UDP 协议正常。

```sh
# 跳过 NTP 协议
ip rule add prio 8000 ipproto udp dport 123-123 goto 9010
ip -6 rule add prio 8000 ipproto udp dport 123-123 goto 9010

# 或者跳过所有 UDP 协议
ip rule add prio 8000 ipproto udp goto 9010
ip -6 rule add prio 8000 ipproto udp goto 9010
```

```sh
root@OpenWrt:~# ip rule
0: from all lookup local
8000: from all ipproto udp goto 9010
9000: from all to 198.18.0.0/30 lookup 2022
9001: not from all dport 53 lookup main suppress_prefixlength 0
9001: from all iif Meta goto 9010
9002: not from all iif lo lookup 2022
9002: from 0.0.0.0 iif lo lookup 2022
9002: from 198.18.0.0/30 iif lo lookup 2022
9010: from all nop
32766: from all lookup main
32767: from all lookup default
```

```sh
root@ARCH-O1 ~ # nc -4uv www.baidu.com 1080
Connection to www.baidu.com (183.2.172.177) 1080 port [udp/socks] succeeded!
^C
root@ARCH-O1 ~ # nc -6uv www.baidu.com 1080
Connection to www.baidu.com (240e:ff:e020:99b:0:ff:b099:cff1) 1080 port [udp/socks] succeeded!
^C
```

**Comment by haeho7** [comment]
@wwqgtxx  大佬，如果有空且方便的话，能麻烦看看这个问题不？

**Comment by JackyHe398** [comment]
要不把fall back, dns 全部關掉，系統軟件全部重裝只試minimum test case 看看會不會不是udp流量的問題。説實話tunnel udp 轉發實在是太基礎了，不如説這就是有tunnel mode的一部分原因。
（p.s. 我也設過openwrt+mihomo網關，一切正常。）

**Comment by JackyHe398** [comment]
還有一個，你用的是透明代理還是socks5/http 代理？ 如果是透明代理的話 tproxy-port被comment掉了

參考：
https://wiki.metacubex.one/config/inbound/port/

**Comment by JackyHe398** [comment]
再用 tcpdump 抓個incoming 的包唄，我猜網關應該是收到包了的，但是不知道爲什麽全部drop了，或者沒forward到mihomo。你可以試試用iperf3 來發包，比較穩定，而且log也清楚。

**Comment by haeho7** [comment]
> 要不把fall back, dns 全部關掉，系統軟件全部重裝只試minimum test case 看看會不會不是udp流量的問題。説實話tunnel udp 轉發實在是太基礎了，不如説這就是有tunnel mode的一部分原因。 （p.s. 我也設過openwrt+mihomo網關，一切正常。）

之前最小化配置测试过了，只要开了 Tunnel 模式就不行，配置如下:

```yml
#port: 7890
#socks-port: 7891
mixed-port: 7892
#redir-port: 7893
#tproxy-port: 7894
log-level: debug
mode: rule
#ipv6: true
allow-lan: true
bind-address: "*"
unified-delay: true
tcp-concurrent: true
find-process-mode: off
disable-keep-alive: false
keep-alive-idle: 600
keep-alive-interval: 15
profile:
  store-selected: true
  store-fake-ip: true

geodata-mode: true
geodata-loader: standard
geosite-matcher: succinct
geo-auto-update: true
geo-update-interval: 24
geox-url:
  geoip: "https://testingcf.jsdelivr.net/gh/MetaCubeX/meta-rules-dat@release/geoip.dat"
  geosite: "https://testingcf.jsdelivr.net/gh/MetaCubeX/meta-rules-dat@release/geosite.dat"
  mmdb: "https://testingcf.jsdelivr.net/gh/MetaCubeX/meta-rules-dat@release/country.mmdb"

external-controller: 192.168.1.1:9090
external-controller-tls: ""
secret: "admin"

proxies:
  - name: SS-SJC
    type: ss
    server: XX.XX.XX.XX
    port: 1984
    cipher: 2022-blake3-aes-128-gcm
    password: XXXXXXXXXXXXX
    ip-version: ipv4-prefer
    udp: true
#    udp-over-tcp: false
#    udp-over-tcp-version: 2
#    tfo: true
#    mptcp: false

tun:
  enable: true
  #stack: system
  #device: mihomo
  #mtu: 1500
  #gso: true
  #gso-max-size: 65536
  udp-timeout: 300
  #strict-route: true
  auto-route: true
  auto-redirect: true
  auto-detect-interface: true
  endpoint-independent-nat: false
  disable-icmp-forwarding: false

#dns:
#  enable: true
#  listen: 0.0.0.0:5353
#  cache-algorithm: arc
#  respect-rules: true
#  prefer-h3: false
#  ipv6: true
#  ipv6-timeout: 300
#  enhanced-mode: redir-host
#  proxy-server-nameserver:
#    - tls://120.53.53.53:853
#    - tls://223.5.5.5:853
#  default-nameserver:
#    - tls://120.53.53.53:853
#    - tls://223.5.5.5:853
#  nameserver:
#    - https://223.5.5.5/dns-query
#    - https://doh.pub/dns-query

proxy-groups:
  - name: PROXY
    type: select
    proxies:
      - SS-SJC

rules:
  - GEOIP,CN,DIRECT,no-resolve
  - GEOSITE,geolocation-cn,DIRECT
  - IP-CIDR,84.17.57.129/32,DIRECT,no-resolve
  - MATCH,PROXY
```

**Comment by haeho7** [comment]
> 還有一個，你用的是透明代理還是socks5/http 代理？ 如果是透明代理的話 tproxy-port被comment掉了
> 
> 參考： [wiki.metacubex.one/config/inbound/port](https://wiki.metacubex.one/config/inbound/port/)

我没有用到任何 inbound 方式，保留 `mixed-port` 配置只是有时候方便其他设备临时连接，基本上用不到，主要的方式还是 Tunnel。

拓扑大致如下:

<img width="581" height="321" alt="Image" src="https://github.com/user-attachments/assets/c07a8324-7730-47e6-bfa2-8c0b4edcbbe9" />

**Comment by haeho7** [comment]
> 再用 tcpdump 抓個incoming 的包唄，我猜網關應該是收到包了的，但是不知道爲什麽全部drop了，或者沒forward到mihomo。你可以試試用iperf3 來發包，比較穩定，而且log也清楚。

试了下用 tcpdump 分别抓取了 OpenWrt 的 LAN、Mihomo-Tunnel (Meta)、WAN 接口的数据包，情况如下:

### 停止 Mihomo 或者关闭 Tunnel 模式

终端（192.168.1.22）iperf3 测试:

```sh
# https://iperf3serverlist.net
root@ARCH-O1 ~ # ./iperf3 -u -c 84.17.57.129 -p 5201
Connecting to host 84.17.57.129, port 5201
[  5] local 192.168.1.22 port 46220 connected to 84.17.57.129 port 5201
[ ID] Interval           Transfer     Bitrate         Total Datagrams
[  5]   0.00-1.00   sec   129 KBytes  1.06 Mbits/sec  92  
[  5]   1.00-2.00   sec   128 KBytes  1.05 Mbits/sec  91  
[  5]   2.00-3.00   sec   128 KBytes  1.05 Mbits/sec  91  
[  5]   3.00-4.00   sec   128 KBytes  1.05 Mbits/sec  91  
[  5]   4.00-5.00   sec   128 KBytes  1.05 Mbits/sec  91  
[  5]   5.00-6.00   sec   128 KBytes  1.05 Mbits/sec  91  
[  5]   6.00-7.00   sec   128 KBytes  1.05 Mbits/sec  91  
[  5]   7.00-8.00   sec   128 KBytes  1.05 Mbits/sec  91  
[  5]   8.00-9.00   sec   128 KBytes  1.05 Mbits/sec  91  
[  5]   9.00-10.00  sec   128 KBytes  1.05 Mbits/sec  91  
- - - - - - - - - - - - - - - - - - - - - - - - -
[ ID] Interval           Transfer     Bitrate         Jitter    Lost/Total Datagrams
[  5]   0.00-10.00  sec  1.25 MBytes  1.05 Mbits/sec  0.000 ms  0/911 (0%)  sender
[  5]   0.00-10.32  sec   901 KBytes   715 Kbits/sec  0.488 ms  0/910 (0%)  receiver

iperf Done.
```

OpenWrt 抓取 LAN 接口流量:

```sh
root@OpenWrt:/# ./tcpdump -i br-lan -nn udp and src host 192.168.1.22
tcpdump: verbose output suppressed, use -v or -vv for full protocol decode
listening on br-lan, link-type EN10MB (Ethernet), capture size 262144 bytes
01:54:12.783473 IP 192.168.1.22.46220 > 84.17.57.129.5201: UDP, length 4
01:54:13.102927 IP 192.168.1.22.46220 > 84.17.57.129.5201: UDP, length 1440
01:54:13.113661 IP 192.168.1.22.46220 > 84.17.57.129.5201: UDP, length 1440
01:54:13.124847 IP 192.168.1.22.46220 > 84.17.57.129.5201: UDP, length 1440
01:54:13.135665 IP 192.168.1.22.46220 > 84.17.57.129.5201: UDP, length 1440
...
```

OpenWrt 抓取 WAN 接口流量:

```sh
root@OpenWrt:/# ./tcpdump -i pppoe-wan -nn udp and dst port 5201
tcpdump: verbose output suppressed, use -v or -vv for full protocol decode
listening on pppoe-wan, link-type LINUX_SLL (Linux cooked), capture size 262144 bytes
01:54:13.102990 IP [WAN_IP].46220 > 84.17.57.129.5201: UDP, length 1440
01:54:13.113742 IP [WAN_IP].46220 > 84.17.57.129.5201: UDP, length 1440
01:54:13.124936 IP [WAN_IP].46220 > 84.17.57.129.5201: UDP, length 1440
01:54:13.135739 IP [WAN_IP].46220 > 84.17.57.129.5201: UDP, length 1440
01:54:13.146809 IP [WAN_IP].46220 > 84.17.57.129.5201: UDP, length 1440
...
```

### 开启 Mihomo 的 Tunnel 模式

终端（192.168.1.22）iperf3 测试:

报错，无法用 UDP 协议连接，用 TCP 则可以。

```sh
# https://iperf3serverlist.net
root@ARCH-O1 ~ # ./iperf3 -u -c 84.17.57.129 -p 5201
Connecting to host 84.17.57.129, port 5201
iperf3: error - unable to read from stream socket: Connection refused
```



OpenWrt 抓取 LAN 接口流量:

只收到一个包

```sh
root@OpenWrt:/# ./tcpdump -i br-lan -nn udp and src host 192.168.1.22
tcpdump: verbose output suppressed, use -v or -vv for full protocol decode
listening on br-lan, link-type EN10MB (Ethernet), capture size 262144 bytes
02:07:47.374143 IP 192.168.1.22.29501 > 84.17.57.129.5201: UDP, length 4
```

OpenWrt 抓取 WAN 接口流量:

没有收到流量

```sh
root@OpenWrt:/# ./tcpdump -i pppoe-wan -nn udp and dst port 5201
tcpdump: verbose output suppressed, use -v or -vv for full protocol decode
listening on pppoe-wan, link-type LINUX_SLL (Linux cooked), capture size 262144 bytes
```

OpenWrt 抓取 Mihomo-Tunnel (Meta) 接口流量:

没有收到流量

```sh
root@OpenWrt:/# ./tcpdump -i Meta -nn udp and dst port 5201
tcpdump: verbose output suppressed, use -v or -vv for full protocol decode
listening on Meta, link-type RAW (Raw IP), capture size 262144 bytes
```

Mihomo 日志:

没有 UDP 相关的日志，但不知道为什么却显示 `192.168.1.22:32853 --> 84.17.57.129:5201` 是 TCP 协议。

```log
mihomo  | time="2026-03-20T02:11:51.074415995+08:00" level=debug msg="[Rule] use default rules"
mihomo  | time="2026-03-20T02:11:51.074698340+08:00" level=debug msg="[TUN] Auto detect interface for 84.17.57.129 --> pppoe-wan"
mihomo  | time="2026-03-20T02:11:51.337739345+08:00" level=info msg="[TCP] 192.168.1.22:32853 --> 84.17.57.129:5201 match IPCIDR(84.17.57.129/32) using DIRECT"
```

**Comment by JackyHe398** [comment]
會是路由表的問題嗎？你要不試試對比一下開tun mode之後
1. `ip -s rule`
2. `nft list ruleset | grep -nE 'Meta|mihomo|tproxy|mark|redirect'` (差不多這樣的東西，可能得改一下）
3. logread -f

在iperf3 發包之前之後的輸出，可能有某條規則把包都擋了。

**Comment by haeho7** [comment]
我之前也是怀疑是策略路由表的问题，但是查了很久都没有找到。

只能使用这种方式 https://github.com/MetaCubeX/mihomo/issues/2584#issuecomment-3967307870 临时添加策略路由跳过 Mihomo 劫持。

但刚刚突然想起了之前在 OpenWrt 跑 Wireguard 和 TinyFecVPN 时处理过类似的情况，然后试着反推了一下，应该是彻底解决了这个问题。

问题是出在 OpenWrt 的防火墙区域间策略上，导致 LAN 区域没办法转发流量给 Mihomo 的 Tunnel 接口。

当时考虑到 Tunnel 模式下 TCP 协议访问正常，所以重点也没有往这方面去分析。

现在回过头想想还是觉得有点奇怪，为什么 OpenWrt 防火墙区域间策略单单影响了 UDP 和 ICMP 协议，而 TCP 协议却没有问题。

解决方式如下:

OpenWrt 新增 Mihomo 区域并关联对应的 Tunnel 接口，之后将 LAN 区域的流量转发到 Mihomo 区域。

```sh
uci add firewall zone
uci set firewall.@zone[-1].name='mihomo'
uci set firewall.@zone[-1].input='REJECT'
uci set firewall.@zone[-1].output='ACCEPT'
uci set firewall.@zone[-1].forward='REJECT'
# 关联对应的 Tunnel 接口名
uci add_list firewall.@zone[-1].device='mihomo'
#uci set firewall.@zone[-1].masq='1'
#uci set firewall.@zone[-1].mtu_fix='1'

uci add firewall forwarding
uci set firewall.@forwarding[-1].src='lan'
uci set firewall.@forwarding[-1].dest='mihomo'
uci commit firewall
service firewall reload
```

<img width="965" height="478" alt="Image" src="https://github.com/user-attachments/assets/a4560685-8e55-4a9a-b990-5cae4d9d5bb7" />

<img width="877" height="321" alt="Image" src="https://github.com/user-attachments/assets/2fa839b9-cb48-4e05-b572-b52ba2fd8b75" />

<img width="1028" height="520" alt="Image" src="https://github.com/user-attachments/assets/059e8fc0-66d5-4e90-b0fb-9877b3c79886" />

**Comment by JackyHe398** [comment]
過幾天看看好了沒唄，沒有的話試試我上面那幾條，我也好奇

**Comment by haeho7** [comment]
截止目前，UDP 使用都很正常，先关闭这个 issues 了。
