### ISSUE TITLE
[Bug] Port forward stops working after program start on router 

### ISSUE THREAD

**Issue by Jon811** [MetaCubeX/mihomo#1737]
### Verify steps

- [X] I have read the [documentation](https://wiki.metacubex.one/) and understand the meaning of all the configuration items I have written, rather than just piling up seemingly useful options or default values.
- [X] I have carefully reviewed the [documentation](https://wiki.metacubex.one/) and have not resolved the issue.
- [X] I have searched the [Issue Tracker](……/) for the issue I want to raise and did not find it.
- [X] I am a non-Chinese user.
- [X] I have tested with the latest Alpha branch version, and the issue still persists.
- [X] I have provided the server and client configuration files and processes that can reproduce the issue locally, rather than a sanitized complex client configuration file.
- [X] I provided the simplest configuration that can be used to reproduce the errors in my report, rather than relying on remote servers or piling on a lot of unnecessary configurations for reproduction.
- [X] I have provided complete logs, rather than just the parts I think are useful out of confidence in my own intelligence.
- [X] I have directly reproduced the error using the Mihomo command-line program, rather than using other tools or scripts.

### Operating System

Linux

### System Version

OpenWrt 23.05.5 r24106-10cc5fcd00 

### Mihomo Version

Version v1.19.0

### Configuration File

```yaml
mode: rule
ipv6: false
log-level: error
allow-lan: false
tproxy-port: 7894
unified-delay: true
tcp-concurrent: true
external-controller: 0.0.0.0:9090
external-ui: ./ui

dns:
  enable: true
  listen: 0.0.0.0:7874
  ipv6: false
  default-nameserver: [1.1.1.1, 1.0.0.1, 8.8.8.8, 8.8.4.4]
  nameserver: [https://dns10.quad9.net/dns-query, https://dns.aa.net.uk/dns-query]

profile:
  store-selected: true
  store-fake-ip: true

routing-mark: 2

sniffer:
  enable: true
  sniff:
    HTTP:
      ports: [80, 8080-8880]
      override-destination: true
    TLS:
      ports: [443, 8443]
    # QUIC:
    #   ports: [443, 8443]
  skip-domain:
    - "Mijya Cloud"

proxies:

  # vless
  - name: "MYVLESS"
    type: vless
    server: 123.456.789.123
    port: 443
    uuid: *******************************
    network: tcp
    tls: true
    udp: true
    flow: xtls-rprx-vision
    servername: www.*******.com
    reality-opts:
      public-key: ********************
      short-id: *****
    client-fingerprint: chrome


proxy-groups:
  # Select (used for selecting proxy or proxy group)
  - name: PROXY
    type: select
    # disable-udp: true
    proxies:
      - MYVLESS

  # Fallback
  #- name: FALLBACK
  #  type: fallback
  #  proxies:
  #    - VASHVLESS1


  #  url: 'https://www.gstatic.com/generate_204' # or https://cp.cloudflare.com/generate_204
  #  interval: 300

  # Load-balance
 # - name: LB-PROXY
 #   type: load-balance
 #   proxies:
 #     - VASHVLESS1

 #   url: 'https://www.gstatic.com/generate_204'
 #   interval: 300
 #   strategy: consistent-hashing # or round-robin

rule-providers:

  ru-blocked:
    behavior: domain
    type: http
    format: text
    url: 'https://cdn.jsdelivr.net/gh/shvchk/unblock-net/lists/clash/ru-blocked'
    interval: 86400
    path: ./ruleset/ru-blocked.yaml

  intel:
    behavior: classical
    type: http
    url: "https://raw.githubusercontent.com/blackmatrix7/ios_rule_script/master/rule/Clash/Intel/Intel.yaml"
    interval: 86400
    path: ./ruleset/intel.yaml

  wix:
    behavior: classical
    type: http
    url: "https://raw.githubusercontent.com/blackmatrix7/ios_rule_script/master/rule/Clash/WIX/WIX.yaml"
    interval: 86400
    path: ./ruleset/wix.yaml

  twitter:
    behavior: classical
    type: http
    url: "https://raw.githubusercontent.com/blackmatrix7/ios_rule_script/master/rule/Clash/Twitter/Twitter.yaml"
    interval: 86400
    path: ./ruleset/twitter.yaml

  instagram:
    behavior: classical
    type: http
    url: "https://raw.githubusercontent.com/blackmatrix7/ios_rule_script/master/rule/Clash/Instagram/Instagram.yaml"
    interval: 86400
    path: ./ruleset/instagram.yaml

  facebook:
    behavior: classical
    type: http
    url: "https://raw.githubusercontent.com/blackmatrix7/ios_rule_script/master/rule/Clash/Facebook/Facebook.yaml"
    interval: 86400
    path: ./ruleset/facebook.yaml

  youtube:
    behavior: classical
    type: http
    url: "https://raw.githubusercontent.com/blackmatrix7/ios_rule_script/master/rule/Clash/YouTube/YouTube.yaml"
    interval: 86400
    path: ./ruleset/youtube.yaml

  discord-domain:
    behavior: classical
    type: http
    url: "https://raw.githubusercontent.com/fildunsky/clash_discord/refs/heads/main/discord-domain.yaml"
    interval: 86400
    path: ./ruleset/discord-domain.yaml

  discord-ip:
    behavior: classical
    type: http
    url: "https://raw.githubusercontent.com/fildunsky/clash_discord/refs/heads/main/discord-ip.yaml"
    interval: 86400
    path: ./ruleset/discord-ip.yaml
rules:
# Правила исполняются по порядку, чем выше, тем раньше
  - SRC-IP-CIDR,192.168.0.127/32,DIRECT # Пускаем весь трафф конкретного устройства напрямую (без VPN)
#  - DOMAIN-SUFFIX,yandex.ru,PROXY # Так можно пускать любой сайт и все его поддомены (mail.yandex.ru и тп) через прокси, если надо напрямую, пишем DIRECT
#  - DOMAIN,gdeposylka.ru,REJECT # Так можно блокировать любой сайт и в теории резать рекламу
  #- IP-CIDR,192.168.0.0/24,DIRECT
  - RULE-SET,ru-blocked,PROXY
  - RULE-SET,intel,PROXY
  - RULE-SET,wix,PROXY
  - RULE-SET,youtube,PROXY
  - RULE-SET,twitter,PROXY
  - RULE-SET,instagram,PROXY
  - RULE-SET,facebook,PROXY
  - RULE-SET,discord-domain,PROXY
  - RULE-SET,discord-ip,PROXY
  - DOMAIN,chatgpt.com,PROXY
  - DOMAIN-SUFFIX,4pda.to,PROXY
  - DOMAIN-SUFFIX,4pda.ru,PROXY
  - DOMAIN-SUFFIX,4pda.ws,PROXY
  - IP-CIDR,31.131.253.250/32,PROXY # IP сайта 4PDA для работы приложения
  - MATCH,DIRECT
```

### Description

When starting program, port forwarding on router stops working

### Reproduction Steps

Start program, no access to home server

**Comment by 2018wzh** [comment]
same here, using firewalld

**Comment by SuprMaks** [comment]
Same for me. Mihomo is blocking response packet from lan PC, directed on request by forwarded port

**Comment by SuprMaks** [comment]
Tested with iperf3 between PC on lan and PC from wan network

With mihomo running:

```
root@TegraOpenWrt:~# tcpdump -i main_wan host 5.104.*.* -c20
tcpdump: verbose output suppressed, use -v[v]... for full protocol decode
listening on main_wan, link-type EN10MB (Ethernet), snapshot length 262144 bytes
03:49:33.415641 IP 5.104.*.*.49404 > 192.168.0.2.55555: Flags [S], seq 2289817215, win 64240, options [mss 1460,sackOK,TS val 1275721010 ecr 0,nop,wscale 7], length 0
03:49:34.462420 IP 5.104.*.*.49404 > 192.168.0.2.55555: Flags [S], seq 2289817215, win 64240, options [mss 1460,sackOK,TS val 1275722054 ecr 0,nop,wscale 7], length 0
03:49:35.485387 IP 5.104.*.*.49404 > 192.168.0.2.55555: Flags [S], seq 2289817215, win 64240, options [mss 1460,sackOK,TS val 1275723078 ecr 0,nop,wscale 7], length 0
03:49:36.509228 IP 5.104.*.*.49404 > 192.168.0.2.55555: Flags [S], seq 2289817215, win 64240, options [mss 1460,sackOK,TS val 1275724102 ecr 0,nop,wscale 7], length 0
03:49:37.554733 IP 5.104.*.*.49404 > 192.168.0.2.55555: Flags [S], seq 2289817215, win 64240, options [mss 1460,sackOK,TS val 1275725126 ecr 0,nop,wscale 7], length 0
03:49:38.557217 IP 5.104.*.*.49404 > 192.168.0.2.55555: Flags [S], seq 2289817215, win 64240, options [mss 1460,sackOK,TS val 1275726150 ecr 0,nop,wscale 7], length 0
03:49:40.602840 IP 5.104.*.*.49404 > 192.168.0.2.55555: Flags [S], seq 2289817215, win 64240, options [mss 1460,sackOK,TS val 1275728198 ecr 0,nop,wscale 7], length 0
03:49:44.651928 IP 5.104.*.*.49404 > 192.168.0.2.55555: Flags [S], seq 2289817215, win 64240, options [mss 1460,sackOK,TS val 1275732230 ecr 0,nop,wscale 7], length 0
03:49:52.755391 IP 5.104.*.*.49404 > 192.168.0.2.55555: Flags [S], seq 2289817215, win 64240, options [mss 1460,sackOK,TS val 1275740359 ecr 0,nop,wscale 7], length 0
03:50:09.160394 IP 5.104.*.*.49404 > 192.168.0.2.55555: Flags [S], seq 2289817215, win 64240, options [mss 1460,sackOK,TS val 1275756742 ecr 0,nop,wscale 7], length 0
```

And without:

```
root@TegraOpenWrt:~# tcpdump -i main_wan host 5.104.*.* -c20
tcpdump: verbose output suppressed, use -v[v]... for full protocol decode
listening on main_wan, link-type EN10MB (Ethernet), snapshot length 262144 bytes
03:48:16.749674 IP 5.104.*.*.58768 > 192.168.0.2.55555: Flags [S], seq 3055390772, win 64240, options [mss 1460,sackOK,TS val 1275644462 ecr 0,nop,wscale 7], length 0
03:48:16.751226 IP 192.168.0.2.55555 > 5.104.*.*.58768: Flags [S.], seq 3853554552, ack 3055390773, win 65535, options [mss 1460,nop,wscale 2,sackOK,TS val 1543971711 ecr 1275644462], length 0
03:48:16.755609 IP 5.104.*.*.58768 > 192.168.0.2.55555: Flags [.], ack 1, win 502, options [nop,nop,TS val 1275644472 ecr 1543971711], length 0
03:48:16.757543 IP 5.104.*.*.58768 > 192.168.0.2.55555: Flags [P.], seq 1:38, ack 1, win 502, options [nop,nop,TS val 1275644472 ecr 1543971711], length 37
03:48:16.759930 IP 192.168.0.2.55555 > 5.104.*.*.58768: Flags [P.], seq 1:2, ack 38, win 53238, options [nop,nop,TS val 1543971720 ecr 1275644472], length 1
03:48:16.764325 IP 5.104.*.*.58768 > 192.168.0.2.55555: Flags [.], ack 2, win 502, options [nop,nop,TS val 1275644481 ecr 1543971720], length 0
03:48:16.765749 IP 5.104.*.*.58768 > 192.168.0.2.55555: Flags [P.], seq 38:42, ack 2, win 502, options [nop,nop,TS val 1275644481 ecr 1543971720], length 4
03:48:16.768464 IP 5.104.*.*.58768 > 192.168.0.2.55555: Flags [P.], seq 42:179, ack 2, win 502, options [nop,nop,TS val 1275644481 ecr 1543971720], length 137
03:48:16.769549 IP 192.168.0.2.55555 > 5.104.*.*.58768: Flags [.], ack 179, win 53203, options [nop,nop,TS val 1543971729 ecr 1275644481], length 0
03:48:16.769580 IP 192.168.0.2.55555 > 5.104.*.*.58768: Flags [P.], seq 2:3, ack 179, win 53203, options [nop,nop,TS val 1543971729 ecr 1275644481], length 1
03:48:16.774856 IP 5.104.*.*.58780 > 192.168.0.2.55555: Flags [S], seq 3288790359, win 64240, options [mss 1460,sackOK,TS val 1275644491 ecr 0,nop,wscale 7], length 0
03:48:16.777602 IP 192.168.0.2.55555 > 5.104.*.*.58780: Flags [S.], seq 1160066210, ack 3288790360, win 65535, options [mss 1460,nop,wscale 2,sackOK,TS val 1543971737 ecr 1275644491], length 0
03:48:16.781949 IP 5.104.*.*.58780 > 192.168.0.2.55555: Flags [.], ack 1, win 502, options [nop,nop,TS val 1275644498 ecr 1543971737], length 0
03:48:16.783756 IP 5.104.*.*.58780 > 192.168.0.2.55555: Flags [P.], seq 1:38, ack 1, win 502, options [nop,nop,TS val 1275644499 ecr 1543971737], length 37
03:48:16.822101 IP 5.104.*.*.58768 > 192.168.0.2.55555: Flags [.], ack 3, win 502, options [nop,nop,TS val 1275644532 ecr 1543971729], length 0
03:48:16.831364 IP 192.168.0.2.55555 > 5.104.*.*.58780: Flags [.], ack 38, win 53238, options [nop,nop,TS val 1543971791 ecr 1275644499], length 0
03:48:16.835260 IP 192.168.0.2.55555 > 5.104.*.*.58768: Flags [P.], seq 3:5, ack 179, win 53203, options [nop,nop,TS val 1543971795 ecr 1275644532], length 2
03:48:16.888864 IP 5.104.*.*.58768 > 192.168.0.2.55555: Flags [.], ack 5, win 502, options [nop,nop,TS val 1275644556 ecr 1543971795], length 0
03:48:16.896088 IP 5.104.*.*.58780 > 192.168.0.2.55555: Flags [.], seq 38:1486, ack 1, win 502, options [nop,nop,TS val 1275644557 ecr 1543971791], length 1448
03:48:16.902920 IP 5.104.*.*.58780 > 192.168.0.2.55555: Flags [.], seq 1486:2934, ack 1, win 502, options [nop,nop,TS val 1275644557 ecr 1543971791], length 1448
```
