### ISSUE TITLE
[Feature] DNS redir-host 模式下拦截 HTTPS 记录以阻止 ECH

### ISSUE THREAD

**Issue by paulzzh** [MetaCubeX/mihomo#2635]
### 验证步骤

- [x] 我已经阅读了 [文档](https://wiki.metacubex.one/)，确认了该功能没有实现
- [x] 我已在 [Issue Tracker](……/) 中寻找过我要提出的功能请求，并且没有找到
- [x] 我是中文用户，而非其他语言用户

### 描述

redir-host 模式下，mihomo 对外开放的 dns 服务器会响应 HTTPS 记录，导致无法嗅探到真实的域名，这会影响分流。
而在 fake-ip 模式，会默认拦截掉 HTTPS 记录并返回空值。
希望 redir-host 下也能不返回 HTTPS 记录，或者加个开关。

以下为 redir-host，返回了有意义的内容导致 ECH 成功建立，希望能返回空值
```
dns:
  enable: true
  listen: 0.0.0.0:53
  ipv6: false
  enhanced-mode: redir-host
21:12:13.281794 IP 192.168.96.120.22640 > 192.168.96.10.53: 52337+ HTTPS? bbs.acgrip.com. (32)
21:12:13.384821 IP 192.168.96.10.53 > 192.168.96.120.22640: 52337* 1/0/0 HTTPS (180)
info [TCP] 192.168.96.120:43648 --> cloudflare-ech.com:443 match Match using 漏网之鱼[日本1]
```

以下为 fake-ip，返回了空值
```
dns:
  enable: true
  listen: 0.0.0.0:53
  ipv6: false
  enhanced-mode: fake-ip
21:34:28.453870 IP 192.168.96.120.60163 > 192.168.96.10.53: 56291+ HTTPS? bbs.acgrip.com. (32)
21:34:28.453945 IP 192.168.96.10.53 > 192.168.96.120.60163: 56291* 0/0/0 (32)
info [TCP] 192.168.96.120:38304 --> bbs.acgrip.com:443 match RuleSet(custom) using 各类涩涩[香港0]
```

查询到是 fake-ip 做了特殊处理，希望 redir-host 也能有这个功能
https://github.com/MetaCubeX/mihomo/blob/d0f33125a98c5964cbfde11cfe8ba2b895bc5941/dns/middleware.go#L179-L180

**Comment by el-psy-k** [comment]
try
```yaml
dns:
  disable-qtype-64: true
  disable-qtype-65: true
```

**Comment by paulzzh** [comment]
> try
> 
> dns:
>   disable-qtype-64: true
>   disable-qtype-65: true

无法使用，这是附加参数，用法不正确

正确用法为：
```
dns:
  enable: true
  listen: 0.0.0.0:53
  ipv6: false
  enhanced-mode: redir-host
  default-nameserver:
    - 223.5.5.5
  nameserver:
    - https://doh.pub/dns-query#disable-qtype-64=true&disable-qtype-65=true
    - https://dns.alidns.com/dns-query#disable-qtype-64=true&disable-qtype-65=true
  proxy-server-nameserver:
    - https://doh.pub/dns-query#disable-qtype-64=true&disable-qtype-65=true
  nameserver-policy:
    "rule-set:cn_domain,private":
      - https://doh.pub/dns-query#disable-qtype-64=true&disable-qtype-65=true
      - https://dns.alidns.com/dns-query#disable-qtype-64=true&disable-qtype-65=true
    "rule-set:geolocation-!cn":
      - "https://dns.cloudflare.com/dns-query#dns&disable-qtype-64=true&disable-qtype-65=true"
      - "https://dns.google/dns-query#dns&disable-qtype-64=true&disable-qtype-65=true"
```

```
12:08:34.668550 IP 192.168.96.120.27923 > 192.168.96.10.53: 35139+ HTTPS? bbs.acgrip.com. (32)
12:08:34.668643 IP 192.168.96.10.53 > 192.168.96.120.27923: 35139* 0/0/0 (32)
12:08:34.804429 IP 192.168.96.120.4963 > 192.168.96.10.53: 21013+ HTTPS? clients4.google.com. (37)
12:08:34.804549 IP 192.168.96.10.53 > 192.168.96.120.4963: 21013* 0/0/0 (37)
```
附加到 dns 的 url 后成功拦截 HTTPS 记录
